File,PV_list_lemmtaized,Difficulty,Duration,k1_percent,k2_percent,k3_percent,k1_2_percent,k1_3_percent,k1_4_percent,k1_5_percent,k1_6_percent,Accent,Genre,URL
AL150,"happen without, turn into, go on, bounce into, come up, think about, look like, move around, turn to, happen in, collide in, get to, look at, come along, think of, go from, enter into, go from, go from, go to, get to, hit in, go to, go through, start off, figure out, do with, get to, get to, collide with, write as, go from, hear of, operate in, consume in, bump into, get to, interact with, slow down, bump into, get over, bump into, bumping into, talk about, bump into, bump into, get over, bump into, get into, go to, think about, talk about, interact with, go into, go up, think about, think about, think about, lead to, think of, think of, interact with, interact with, think about, think about, think about",18,12.27,65.39,13.8,7.64,79.19,86.84,91.08,91.08,92.36,American,AL,https://www.youtube.com/watch?v=KyiTGvnIPbo
AL151,"look at, involve in, hear about, grow with, work on, sit in, start down, figure out, give away, seem like, come to, give away, get into, start with, come by, do in, pronounce as, connect to, go through, come across, call in, work on, engage with, think for",13,4.13,74.4,13.86,4.52,88.25,92.77,93.98,93.98,94.28,American,AL,https://www.youtube.com/watch?v=_QrLcrLAg50
AL152,"work on, focus on, deal with, care about, come down, think about, happen in, seem like, leave like, knock down, feel like, involve in, go to, cost to, pronounce in, think about, do with, learn by, learn by, learn in, learn by, come in, learn by, learn in, interact with, associate with, look like, get to, work with, come along, end up, set up, hinge around, involve with, involve as, work as, work with, sit down, affiliate with, come out, focus on, talk about, have in, get into, have between, look at, come down, look across, participate in, think at, pull on, happen on, develop with, lead into, go on, apply to, apply to, happen in, arrive at, start within, know about, go in, apply in, come out, start with, set up, go on, know thatsopen, go on, focus on",23,8.93,64.5,11.26,11.26,75.76,87.02,89.69,89.69,90.46,American,AL,https://www.youtube.com/watch?v=ozpeEjCMKmw
AL153,"think of, work with, publish under, come along, do like, advocate for, come along, give away, leave of, education beyond, go around, go on, publish in, look at, build up, lie down, read through, license to, involve in, come from, come into, move through, go with, end up, think in, move from, strike by, use for, find out, think of, think of, start with, go to, listen to, come across, involve in, interact with, play in, learn for, come by, come by, go through, come by, talk about, go on, connect to, sit with, sit with, feed off, refer to, end up, end up, look at, keep for, look at, take for, function with, involve with, send to, involve in, look at, throw off, end up, turn to, shape by, preface on, engage with",22,10.62,61.33,15.7,9.78,77.04,86.81,88.74,88.74,89.78,American,AL,https://www.youtube.com/watch?v=IyrKQZbdAUs
AL154,"talk about, involve in, transpire in, talk about, intend to, vary in, walk out, cut down, belong to, think about, think about, think about, create with, look like, cite as, move in, die in, affix to, move into, attach in, expire on, eldre versus, go to, use by, know within, think about, participate in, translate into, localize for, collaborate around, engage in, deal like, grow in, move from, opt out, sit in, copyright from, fix in, move to, share with, go out, express to, use in, use from, get into, happen in, fix in, teach in, teach in, set up, talk about, run up, do as, do with, engage in",21,7.02,61.79,16.06,10.16,77.85,88.01,91.67,91.67,91.67,American,AL,https://www.youtube.com/watch?v=JSIpmVS44Ek
AL155,"teach as, go through, happen in, cut off, involve in, make with, seem like, involve in, come up, uta at, pay for, pay for, come in, write up, pay as, pay for, pay for, think about, pay for, pay for, buy back, come into, talk about, get around, influence for, publish in, share in, work with, count as, accept in, turn in, seem to, think about, think about, change as, retire out, come in, look at, think about, think about, explain to, do with, publish in, publish in, publish in, buy in, take in, act of, oppose to, tease out, look at, cite in, publish in, publish in, work with, publish in",19,8.8,60.97,14.75,13.85,75.72,89.57,92.09,92.09,92.63,American,AL,https://www.youtube.com/watch?v=D39pvoJGWLA
AL156,"set up, do in, get into, solicit in, set up, hear of, go to, engage in, talk about, engage in, engage in, listen to, look at, list on, look at, hint at, talk about, depend on, make with, paste into, hand out, play with, submit in, hide in, protect by, operate on, translate into, turn out, engage in, engage in, come to, hold to, speak around, use by, police of, do by, happen with, find out, seem like, look at, give out, take toward, comply with, go out, go on, go to, do via, share with, share with, tarnish by, talk abouthow, engage with, set up, go to, listen to, add to, go to, go on, have for, consume with, align for, consume with, come to, pay for, ask for, pay for, look at, agree with, go out, look at, look at, look in, volunteer with",19,11.59,61.37,17.29,11.68,78.66,90.34,94.08,94.08,94.39,American,AL,https://www.youtube.com/watch?v=wleIPnZ8xvI
AL157,"see as, think about, set of, engage in, mean in, get into, retain in, engage in, come at, do for, have with, happen with, pay for, top out, pay over, happen in, make for, suffer through, make to, arise with, participate in, come from, remove from, wipe from, look like, engage in, engage in, come around, do with, look at, depend on, create in, pass through, pay for, cut off, pile up, pile up, pile up, pay for, root in, belong to, distribute in, do with, tinker with, come from, study out, backspace over, write in, engage in, talk about",20,10.35,62.37,16.61,11.02,78.98,90,91.86,91.86,92.03,American,AL,https://www.youtube.com/watch?v=SaTi4rqsTyA
AL158,"push on, talk about, attach to, push up, do in, fit into, know from, work for, occur to, change from, involve on, go out, feel like, pass through, pay for, think in, talk about, pay for, expect from, talk to, come with, send out, go through, connect with, look at, work with, use in",22,6.26,67.21,14.55,9.01,81.76,90.76,93.53,93.53,93.76,American,AL,https://www.youtube.com/watch?v=xxSRh1Fg42U
AL159,"involve with, fit into, involve in, think about, do in, sit down, stare at, engage in, start over, collaborate across, think about, come from, start from, teach at, dress up, come along, benefit from, get at, exist within, reflect in, leave off, start by, search for, work for, work with, serve in, connect up, save about, look at, drop out, feel like, stay in, talk about, know from, base on, look at, come in, turn in, mention from, find at, think about, do with, play in, speak at, come from, come in, get up, engage in, collaborate among, requirement through, go from",18,8.62,67.28,14.6,9.8,81.89,91.68,92.79,92.79,93.72,American,AL,https://www.youtube.com/watch?v=-U5A-D95sl8
AL160,"accomplish with, end up, base on, enable in, talk about, play into, do on, know behind, talk about, end up, end up, focus on, learn in, create by, learn by, engage in, distribute in, focus on, exist in, come from, meet with, meet with, connect to, engage in, come with, go with, talk about, declare by, do with, talk as, do for, do for, move from, center around, come into, go to, interact with, duplicate with, grow to, fail among, learn in, walk into, go on, know by, have in, create in, launch through, work with, work in, learn for, come out, attach to, know with, refer to, happen in, do in",17,9.71,60.13,14.24,12.23,74.37,86.6,88.94,88.94,90.62,American,AL,https://www.youtube.com/watch?v=A05IEigrVqU
AL161,"think about, relate to, perplex at, know in, get with, need for, happen in, think for, know into, come across, grapple with, integrate into, teach at, talk about, go on, grapple with, learn from, teach with, require on, go on, switch from, do on, occur to, pull up, do with, expand out, wake up, depend on, get up, look at, use in, seem to, come up, progress down, engage with, base on, review in, comprise of, look like, pick up, come out, catalogue in, look for, find in, teach over, search for, drown in, look for, search by, adopt of, bring into, plug through, move in, add to, do with, think of, reuse in, think from, look at, grant by, have over, fit into",21,13.12,59.24,15.63,10.87,74.86,85.73,87.64,87.64,88.45,American,AL,
AL162,"get into, involve in, do around, go through, think about, feel about, compare to, take off, pay for, result in, download off, cut into, lie out, work in, talk about, publish in, turn to, think of, look at, look at, look at, look at, focus on, transit?kind of, create in, behave in, work on, look at, involve in, get from, get into, difference in, base on, swap out, engage in, go into, contribute to, talk about, do with, go on, experience through",16,6.69,66.67,11.95,10.9,78.62,89.52,90.99,90.99,92.03,American,AL,
AL163,"welcome back, talk about, say in, lead up, interact with, throw off, engage in, think about, talk about, grow through, look at, apply in, look at, go on, take from, happen in, look at, interact with, do with, deal with, deal with, look at, involve in, log on, move to, talk about, deal with, rely on, log on, look at, say as, engage in, mature into, move into, get at, got to, represent in, get at, happen with, move behind, pick up, behave in, look at, base on, base on, align with, have through, talk about, create in, create in, define by, seem like, think in, acquiesce at, compete with, move into, look at, look at, provide to, win at, escalate to, get to, talk about, base on, study at, study on, use but?just, turn out, miss on, publish in, do with, align to, align to, align to, leave with, figure out, do with, look at, look at, look at, follow down, do in, stand up, align to, make in",18,10.4,58.82,16.41,13,75.23,88.24,91.33,91.33,92.41,American,AL,
AL164,"look at, go over, sit down, seem like, consider to, hear about, be on, look at, call at, work with, reach out, figure out, design for, design for, design for, look at, log into, go on, look at, see past, lose on, win on, play with, stand up, know between, know on, think at, present to, reach out, explain to, Graph beneath, land on, engage with, implement in, describe in, go into, show up, create for, embed in, think about, face to, end up, end up, come from, think about, happen for, understand like, happen from, work from, turn out, engage in, engage in, turn out, look at, explain in",14,8.3,62.34,13.75,11.11,76.08,87.19,89.08,89.08,89.83,American,AL,
AL165,"go from, test on, scroll through, think about, persuade by, comprise of, go from, gather to, symbolize by, start with, live in, serve to, live in, go to, allow for, look at, run for, work than, rise in, take about, involve in, promise to, come to, associate with, talk about, help out, provide with, follow by, catch on, work for, have for, conspire against, rise up, know for, experiment with, originate as, know in, come out, come in, have to, lead to, come with, drill for, turn into, live in, remember as, journey to, travel to",19,10.09,59.89,16.48,6.87,76.37,83.24,87.77,87.77,89.7,American,AL,
AL166,"end up, add up, talk about, talk about, talk about, talk about, talk about, turn to, see as, sound like, wake up, live at, get to, lead to, associate with, associate with, associate with, get to, say about, talk about, know about, go to, know about, come from, think of, connect to, run under, use for, use as, look like, go on, talk about, have for, dress up, go with, happen to, happen to, morph into, come from, fade into, turn out, bring about, dry up, pick up, leave for, move to, motivate by, think about, think about, motivate by",14,8.43,61.61,13.62,7.74,75.23,82.97,87.31,87.31,88.39,American,AL,
AL167,"talk about, talk about, point out, pop up, have in, engage in, suffer for, live in, give up, accord to, yoyo between, find in, show up, shift from, seesaw throughout, start out, take on, engage in, scoodlypoope with, overtake by, survive to, ride on, ride on, happen in, lead to, come in, settle into, wait for, know as, turn out, become like, pass on, die in, spread over, shift to, come before, keep with, take over, rely on, serve in, come by, come on, come along, begin around, grow from, base on, base on, lop off, do in, apologize for, happen to, base on, blow up, come to, talk about, talk about, talk about, talk about, talk about",18,10.63,59.37,13.5,7.73,72.87,80.6,84.27,84.27,86.24,American,AL,
AL168,"talk about, stare at, think of, think of, stand among, last from, talk about, mean for, go out, go to, leave behind, walk on, culminate in, bury with, see as, live along, last from, last from, seem like, act like, act like, act like, build between, build for, build for, work for, lead to, start with, start out, reign over, say about, fight over, follow by, merge with, relaxed like, disimilate into, sound like, emerge from, take over, focus on, remember from, jump off, replace by, rob by, rob by, find out, leave for, psyche about, die before, discover in, die of, work out, build around, die in, look at",22,10.34,58.54,13.64,8.26,72.18,80.44,83.75,83.75,85.26,American,AL,
AL169,"learn about, start with, wait for, know about, come from, write about, hold on, found in, rule with, know as, live in, know about, come from, identify with, talk about, come from, have in, ask about, ask about, devoted to, gall to, begin by, see as, think about, exemplify by, think about, live in, consist of, limit to, range from, live in, rebel in, emerge as, make up, happen during, settle into, sound out, look to, hinder by, create in, buy into, rhyme with, stand for, come from, evidence by, go to, sail to, submit to, point out, fight with, see as, participate in, set off, win with, look at, engage in, end up, beat by, return to, worry about, seek from, talk about",16,10.41,58.16,13.29,9.74,71.45,81.18,84.21,84.21,85.13,American,AL,
AL170,"talk about, tend to, lead to, know about, come from, migrate down, know about, know as, know as, cut to, read from, become of, make into, speak to, come from, stand on, talk to, combine for, suffer from, happen in, transfer to, reborn as, release from, begin as, stay in, listen to, accord to, go to, snuck out, seek out, come to, meditate for, meditate for, come to, want of, dump by, talk about, talk about, talk about, free from, end up, refer to, involve in, talk about, rule through, end up, bring up, hold on, put up, rule through, accord to, go like, see in, lead to, decline in, describe as, happen with, worship as",19,10.8,59.08,12.79,8.82,71.87,80.69,83.76,83.76,85.42,American,AL,
AL171,"talk about, talk about, last in, know as, divide into, rule by, come from, end for, run out, overthrow after, happen to, go over, leave aside, overthrow by, disintegrate into, war over, end with, replace by, last for, rule over, conquer by, result in, fall to, last for, come to, rid of, believe in, expect of, come in, come to, replace by, last for, base on, get to, exaggerate for, focus on, think for, set up, come to, accord to, accord to, behave as, shut up, go to, live during, lead to, bring about, look to, boil down, care for, factor into, look to, contain in, translate as, depend on, interact with, translate as, refer to, associate with, behave like, engage in, engage in, rest on, point out, lead to, write by, mirror by, talk about",20,11.04,57.26,15.31,10.52,72.57,83.09,85.75,85.75,87.62,American,AL,
AL172,"talk about, make of, design in, turn into, stitch in, screenprinte in, sell to, pause for, snivel in, put on, form by, live in, work in, go from, think of, sell to, mark up, produce in, spin from, come from, buy off, use for, originate in, focus on, wait for, humiliate in, migrate to, take off, equip by, travel to, go through, complain about, cause by, say of, grow along, state for, speak of, travel on, go into, dwindle in, know as, differ from, venerate to, transform from, focus on, hang around, live in, travel along, come from, know as, result in, die in, live in, live in, look at, foster by, talk about",14,8.84,56.01,14.71,8.77,70.72,79.49,83.59,83.59,84.87,American,AL,
AL173,"learn about, raise by, stand for, focus on, accord to, determine with, choose from, divide into, choose from, serve as, do in, serve as, serve as, talk about, take over, come out, lay down, return to, name for, influence by, know from, bear around, do from, serve in, rise through, run for, get from, succeed in, work out, go to, die in, return to, prosecute for, return with, set out, track down, side with, scoddilypoope with, go on, bet on, attach to, stop off, extend for, bring about, degenerate into, choose from, choose from, rise to, open up, look at, march against, look at, dispense with, start out, comprise of, talk about, talk about, rise up, control by, incorporate into, rule by, march on",20,11.2,56.57,14.82,8.76,71.39,80.15,83.38,83.38,84.79,American,AL,
AL174,"talk about, bear in, start with, grow up, think of, eke out, center around, record in, appear to, say unto, walk before, live in, chat with, involve in, stick with, accord to, stick by, lead to, speak for, absorb into, know for, know as, show up, wait for, bring in, return to, get through, get to, threaten to, execute in, turn to, fight over, fight over, matter to, come to, reject by, acquaint with, write down, get in, write of, write about, set forth, open up, stick with, kill by, relate to, keep to, convert to, remember about, hide from, talk about, talk about, flourish in, allow for, persecute by, fed to, convert to, take off",20,10.7,61.18,11.65,7.1,72.82,79.92,83,83,84.07,American,AL,
AL175,"talk about, get to, fall until, conquer by, send into, know for, sack by, go with, go like, put forth, rule with, wrap up, lead to, begin with, buy into, care about, remember from, stick with, fight with, team with, happen with, wear by, blow up, bring to, know as, live in, descend into, lead to, center in, center in, go from, go to, rule by, forget about, turn out, cheer on, break out, rule by, go to, go along, rule for, build for, look like, go on, sound like, drive out, come from, matter for, serve as, answer to, appoint by, survive for, survive in, survive in, survive in",15,11.66,56.54,12.58,9.4,69.12,78.53,82.97,82.97,84.5,American,AL,
AL176,"think about, look at, think about",8,1.52,85.26,10.53,1.05,95.79,96.84,97.89,97.89,97.89,American,AL,https://www.youtube.com/watch?v=8fBDGRl1v8E
AL177,"talk about, run through, go with, come between, forget about, depend on, die from, die from, come in, go to, live in, base on, dress up, happen in, flow into, dominate by, fit on, expand out, do in, hold on, hail from, take over, wait for, take on, descend into, press into, try over, point out, set up, usher in, center in, write in, do with, turn toward, stay in, exemplify by, build by, build in, live in, live in, end up, write in, rule over, fight at, hear of, end up, dominate to, dominate to, encourage by, last from, talk about, use in, ship throughout, go on, run out, lead to, write down, know as",21,10.41,55.79,12.74,8.06,68.53,76.59,79.58,79.58,81.27,American,AL,https://www.youtube.com/watch?v=M_zTup1NswY
AL178,"talk about, talk about, root for, root against, idealize by, start by, drive by, bring on, start in, live among, move into, kick at, begin with, figure out, learn from, call on, saideth until, rid of, war on, thow out, shape like, come at, adventure in, stay in, gain in, go to, think about, lead to, come up, take up, head for, cry out, volunteer for, get off, encounter along, arrive in, hide under, succeed in, step up, get in, move onto, know to, expand by, call for, call off, hang around, continue through, focus on, go to, volunteer for, know from, go by, come up, pay for, result in, fight on, come up, dethrone by, stick in, turn out, conquer by, open up, take up, believe in, conceive of, mean to",23,10.41,56.83,10.98,9.71,67.82,77.52,80.97,80.97,82.38,American,AL,https://www.youtube.com/watch?v=WBSCJYUjUTM
AL179,"talk about, talk about, shut up, appear on, fold in, fit in, turn to, write by, preserve via, think of, write as, live in, apply over, memorize by, listen to, go to, bring with, give away, recover from, travel through, return to, rule by, live in, rule by, talk about, find out, bring up, look like, convert to, start with, rule until, run from, trade with, seem like, go to, spread along, benefit from, see in, take off, replace by, return from, bring back, visit by, fascinate by, go into, go from, treat like, engage in, fall to, overthrow for, live in, go of, come on, shut up, move to, bring with, live in, wait for, influence by, start by, arrive in, go on, adopt by, start out, look at, rely on, fall into, look at",23,9.58,56.43,15.16,9.34,71.58,80.92,83.49,83.49,85.12,American,AL,https://www.youtube.com/watch?v=E6HZWCmWG_E
AL180,"wait for, do in, renowne for, talk about, go on, accord to, live near, think of, go to, come out, hang out, start with, go to, bear around, poison to, kill during, base on, show up, vote with, go on, stretch from, fall to,  in, suck at, BIRTHDAY to, live on, leave with, happen to, build on, compare to, hole up, terrify of, return to, exist for, fall into, walk from, believe in, tie to, think of, prosper throughout, bathe in, clasp to, blend in, take up, open up, open up, infect with, accord to, trade with, think about, end up",20,10.13,56.62,12.98,8.65,69.59,78.24,80.79,80.79,81.93,American,AL,https://www.youtube.com/watch?v=W06fuMMGOBI
AL181,"talk about, talk about, focus on, make out, focus on, make out, talk about, pay for, say with, blow up, wait for, go to, live in, trade for, live in, take off, hear about, think of, think of, count on, sail between, sail between, arrive on, participate in, set up, act as, dominate by, point out, dominate by, set by, find out, kidnap by, strap onto, trade for, ship in, come from, ship from, come from, navigate by, spread throughout, tack against, travel in, live in, learn about, spread to, trade with, act as, go through, happen to, rise up, go through, see in, decline in, bring up, trough in",22,9.3,60.17,13.32,7.74,73.5,81.23,85.24,85.24,86.82,American,AL,https://www.youtube.com/watch?v=-f4BPW86xtU
AL182,"talk about, talk about, return to, seem like, shut up, lead to, make up, walk around, build for, rely on, go to, head to, fall to, mean like, make of, consort with, poope on, root from, accord to, bury in, go to, disgust by, trade with, make out, know for, come from, add to, sound like, answer to, mean at, live in, live in, last from, found by, mean like, rule from, rule from, judge from, control about, remember from, send out, rule over, deal with, shut up, do in, get into, link to, start out, happen in, bring up, break down, return to, speak of, carry of, listen up, equip by, exist for, look for, turn out",14,9.27,58.12,13.56,7.38,71.68,79.06,82.42,82.42,82.82,American,AL,https://www.youtube.com/watch?v=JRNVuFTt5QQ
AL183,"talk about, talk about, talk about, talk about, migrate from, come down, found in, develop from, fight with, end with, venture into, derive from, verbose than, rely on, fall into, bond to, farm for, step on, end up, accord to, fall in, show up, know as, vie for, reemerge in, look at, go to, set up, set up, bring about, live in, do in, send from, know as, translate to, wellpositione for, go to, weaken in, look like, see in, culminate with, see as, track down, turn out, know as, negotiate for, know as, rule from, trust with, work with, sound like, depend on, point out, point to, set out, return to, hunt down, echo through, see by, think of, direct by, write by, guess at, relate to, answer by, say in",18,10.14,54.13,14.23,9.4,68.36,77.76,81.45,81.45,82.59,American,AL,https://www.youtube.com/watch?v=wTwuD7h8UXs
AL184,"pass for, hear of, move on, come to, sit in, remember from, dominate by, begin with, hear of, rule by, get in, rise from, go to, consist of, know as, know to, come to, engage in, trade with, jump on, disintereste in, build under, base on, come to, search for, get in, live in, land at, look for, answer with, sum up, create like, sit in, rely on, add to, base on, end up, know as, know as, figure out, base on, figure out, accord to, split between, unclaimed by, land on, pay for, fail at, return with, discuss in, encounter in, return from, speak for, depend on",17,9.6,57.34,12.79,9.69,70.12,79.81,83.04,83.04,84.12,American,AL,https://www.youtube.com/watch?v=KdaefjWcxiU
AL185,"talk about, know about, usher in, coincide with, idealize as, look at, look at, open up, concern with, add to, know as, stick with, associate with, focus on, come to, go to, prime for, specialize in, turn out, remember from, remember from, figure out, trade with, trade with, pay for, put on, pose for, pay for, lead to, talk about, weave in, dye with, find in, write to, wre from, accrue to, flee for, thank for, search for, come on, find in, happen in, start with, live amid, turn off, climb on, live in, base on, go down, filter down, experience by, live on, govern by, matter to, care about, introduce to, talk about, talk about, bear in, occur over",18,10.55,56.51,13.65,9.82,70.15,79.97,82.91,82.91,84.44,American,AL,https://www.youtube.com/watch?v=dOnuzaPXPHk
