File,PV_list_lemmtaized,Difficulty,Duration,k1_percent,k2_percent,k3_percent,k1_2_percent,k1_3_percent,k1_4_percent,k1_5_percent,k1_6_percent,Accent,Genre,URL
AL075,"take away, go out, go to, sit at, trek out, operate in, skim off, pay for, skim off, pay for, bother by, kick up, rid of, kick out, give out, pay for, fall in, say before, pay for, go in, open up, come to, set up, turn out, invest in, invest in, come in, pass away, skim off, go out, stick to, gather up, say in, situate in, assist by, write to, labor to, turn out, happen with",22,12.09,63.5,12.42,10.43,75.92,86.35,88.65,88.65,89.72,American,AL,https://www.youtube.com/watch?v=IIzwCBraDbM
AL076,"talk about, start with, bandy about, talk about, stand for, focus on, reference in, make up, tap out, go on, look like, go to, look for, put into, take off, focus on, own by, control by, run in, jump in, turn out, train for, look at",18,3.56,70.56,8.87,8.87,79.44,88.31,90.32,90.32,90.73,American,AL,https://www.youtube.com/watch?v=cHjrSYoL9pw
AL077,"talk about, drive on, talk about, come from, look at, combine with, explain to, talk about, talk about, look at, look at, start with, come from, come from, come from, come from, map to",16,4.04,67.32,12.2,10.73,79.51,90.24,92.2,92.2,92.68,American,AL,https://www.youtube.com/watch?v=Yu2LC3qvs74
AL078,"talk about, think about, think about, look at, oppose to, talk about, charge on, turn out, look for, work in, go through, drive by, depend on, look for",19,3.35,75.47,9.43,4.25,84.91,89.15,90.57,90.57,91.51,American,AL,https://www.youtube.com/watch?v=qXbKOjVx2ZI
AL079,"think about, walk into, base off, start with, look for, look for, come in, work in, migrate from, join up, talk about, join up",15,2.15,84.31,6.54,5.23,90.85,96.08,99.35,99.35,99.35,American,AL,https://www.youtube.com/watch?v=UPetkNFXrxI
AL080,"talk about, have about, think about, think in, look through, perpetuate by, figure out, go to, drop out, drop out, happen by, come from, work with, do at, go to, go to, bet on, think of, bring down, work with, moderate with, lead by, make up, go on, get to, move into, go up, belong to, execute against, think of, work with, think about",21,6.43,69.84,11.41,8.97,81.25,90.22,92.39,92.39,94.29,American,AL,https://www.youtube.com/watch?v=J94JwQmf-kA
AL081,"go to, think out, think of, end up, come up, brainstorm in, lie in, talk to, find out, think of, walk in, advocate for, walk in, narrow down, see on, go out, see for, lie with",16,2.57,83.25,7.85,4.71,91.1,95.81,96.34,96.34,96.34,American,AL,https://www.youtube.com/watch?v=9s92Y6Svyrg
AL082,"talk about, lay out, focus on, take on, start with, build up, move on, think about, land on, expand out, build up",19,1.83,78.17,9.86,7.75,88.03,95.77,97.18,97.18,97.18,American,AL,https://www.youtube.com/watch?v=tj2JiTiQqjs
AL083,"passionate about, talk about, grow up, grow up, rely on, get up, get to, rigor to, grow up, create by, create by, rigor in",21,1.44,81.25,10.16,4.69,91.41,96.09,98.44,98.44,98.44,American,AL,https://www.youtube.com/watch?v=6ygezBmQrVs
AL084,"go to, start with, start about, interact with, imagine before, come up, align with, list at, involve with, apologize for, put on, focus on, do in, go down, achieve from, get from, look like, talk about, see through",19,3.09,69.44,11.57,9.72,81.02,90.74,93.06,93.06,93.52,American,AL,https://www.youtube.com/watch?v=bV888zpsuTI
AL085,"drill down, look at, apologize for, get through, look at, interact with, compute for, lay out, dig down, put in, end up, work out",20,1.68,74.67,9.33,8.67,84,92.67,94.67,94.67,94.67,American,AL,https://www.youtube.com/watch?v=nGPhnfJN0T0
AL086,"talk about, go from, decide with, talk about, start with, work in, work at, build up, work on, play in, look at, come from, come from, include in, look at, take in, look at, commit to, start off, look at, go from, think about",16,3.32,80,9.52,6.19,89.52,95.71,98.1,98.1,98.57,American,AL,https://www.youtube.com/watch?v=AvOzgmr0zzQ
AL087,"think about, do in, come in, explain to, talk about, look through, point out, speak to, do with, focus on, start with",16,2.05,81.71,7.32,6.71,89.02,95.73,96.95,96.95,97.56,American,AL,https://www.youtube.com/watch?v=bMJe6tAMgjo
AL088,"start by, put up, listen to, go on, use throughout, depend on, talk to, exist in, talk to, sound like",14,2.11,81.91,8.54,3.02,90.45,93.47,93.47,93.47,93.97,American,AL,https://www.youtube.com/watch?v=NmTlmZz37Ac
AL089,"talk about, figure out, look at, come to, come to, look like, go through, throw out, think about, throw on, work in, correspond to, focus on, sum up, come from",11,2.82,75.36,9.66,3.38,85.02,88.41,92.27,92.27,92.27,American,AL,https://www.youtube.com/watch?v=AhTv4Vbbktk
AL090,"talk about, turn out, talk about, talk about, come from, oppose to, leafs for, talk about, end in",11,1.67,78.7,6.51,0.59,85.21,85.8,88.17,88.17,89.35,American,AL,https://www.youtube.com/watch?v=vGwlBBO6_vw
AL091,"focus on, explain in, think of, make of, make of, do with, come to, look at, look like, depend on, live in, apply to, remember for, apply to, talk about, talk about, worry about, do with, come to, come to, compose of, work with, refer to, sum up, come to, come to, live in, talk to, get from, translate for, go like, travel from, flow through, get to, stop for, go into, use for, unite by, work with, converge toward",15,5.38,68.1,10.63,4.05,78.73,82.78,86.08,86.08,87.34,American,AL,https://www.youtube.com/watch?v=CZ_lwA_ynKE
AL092,"talk about, talk about, talk about, illustrate for, look like, change to, talk about, refer to, say on, refer to, refer to",15,2.82,74.88,12.32,4.43,87.19,91.63,93.6,93.6,93.6,American,AL,https://www.youtube.com/watch?v=ohZjh2M0Om8
AL093,"bring up, talk about, speak of, speak of, talk about, talk about, talk about, oppose to, talk about, talk about",12,1.52,77.12,8.47,0.85,85.59,86.44,87.29,87.29,89.83,American,AL,https://www.youtube.com/watch?v=C6JoT6VcZqU
AL094,"talk to, get into, think by, dig into, come from, come to, come to, refer to, get through, talk about, look at, pick up, talk about, pick up, tell by, pick up, look at, manifest in, get from",16,2.63,78.07,5.88,5.88,83.96,89.84,89.84,89.84,90.91,American,AL,https://www.youtube.com/watch?v=jiVJ0JS3J1o
AL095,"welcome to, explain by, turn into, turn into, worry about",12,1.71,72.05,5.59,1.86,77.64,79.5,83.23,83.23,83.23,American,AL,https://www.youtube.com/watch?v=vo6Yc3qx0Oo
AL096,"talk about, borrow into, come from, borrow into, depend on, talk to, talk about, talk about, drive along, go through, go over, encounter in, find in, care for, singular on, come in, come to",18,4.04,66.41,8.59,7.03,75,82.03,86.33,86.33,87.11,American,AL,https://www.youtube.com/watch?v=IH2v0aP94Bo
AL097,"talk to, go like, become in, work with, come from, get to, look at, come from, sound at, sound like, find in, exist in, deal with, turn into, turn into, turn into, drop out, replace in, drop off, leave with, go from, go over, look like, go over, jake out",18,3.91,70.88,8.42,1.05,79.3,80.35,83.16,83.16,83.51,American,AL,https://www.youtube.com/watch?v=8io7-atxtJI
AL098,bring along,15,0.84,84.95,6.45,2.15,91.4,93.55,94.62,94.62,94.62,American,AL,https://www.youtube.com/watch?v=Q2Ddty82ZA4
AL099,"talk about, oppose to, move from, refer to, throw on, talk about, figure out, sound like, listen to, sound like, operate under, get along",20,2.09,79.01,11.05,2.76,90.06,92.82,94.48,94.48,94.48,American,AL,https://www.youtube.com/watch?v=THS8NBnusjs
AL100,"talk about, happen in",12,1.16,81.13,8.49,0.94,89.62,90.57,92.45,92.45,92.45,American,AL,https://www.youtube.com/watch?v=zf04nzZiXPA
AL101,"welcome to, talk about, happen in, oppose to, singe in, happen in, know about",15,1.37,82.88,7.21,0.9,90.09,90.99,91.89,91.89,92.79,American,AL,https://www.youtube.com/watch?v=y_CfMMdPXEY
AL102,"welcome to, talk about, refer to, focus on, walk to, go to, walk to, figure out, go from, end with, end with",12,1,88.7,6.09,1.74,94.78,96.52,96.52,96.52,96.52,American,AL,https://www.youtube.com/watch?v=v6qNPLayC28
AL103,"welcome to, talk about, oppose to, talk about, talk about, put in",13,1.39,76.36,7.27,1.82,83.64,85.45,86.36,86.36,86.36,American,AL,https://www.youtube.com/watch?v=MicNR5lINHM
AL104,"talk about, talk about, bring along, mean in, throw out, happen in, depend on, get into, go on, stop at",16,1.81,81.82,7.14,3.9,88.96,92.86,92.86,92.86,93.51,American,AL,https://www.youtube.com/watch?v=HItXX2jnrH0
AL105,"talk about, write out, think of, look at, look like, appear to, smell like, smell like, smell like",16,2.22,82.07,11.03,2.07,93.1,95.17,95.17,95.17,95.17,American,AL,https://www.youtube.com/watch?v=l34ioHkQW48
AL106,"talk about, conjugate in, behave in, look like, tack onto, tack onto, listen to, think between, focus on, work for, talk about, talk about, talk about, say in, go through",17,2.21,82.04,8.38,1.2,90.42,91.62,92.22,92.22,92.22,American,AL,https://www.youtube.com/watch?v=pLg0bYYBgvE
AL107,"talk about, form like, look like, go from, turn out, apply to",11,1.34,75.37,11.94,2.24,87.31,89.55,92.54,92.54,92.54,American,AL,https://www.youtube.com/watch?v=mi8Ft5_Eikw
AL108,"talk about, shift in, bear with, do with, talk about, talk about, begin with, bounce along, go from, ring for, talk about, go on, go from, go from",14,2.4,78.68,8.63,2.54,87.31,89.85,89.85,89.85,89.85,American,AL,https://www.youtube.com/watch?v=oIhmbcFE4r8
AL109,"talk about, talk about, take for, talk about, fall into, go with, eat by, speak in, speak in, look like",16,2.29,79.19,9.25,2.31,88.44,90.75,91.33,91.33,91.91,American,AL,https://www.youtube.com/watch?v=Nu9-AWAzbsM
AL110,"welcome to, fall into, end with, end with, find in, follow up, become past, stand on, stand on, listen to, show up, believe in",17,2.11,75.84,9.55,2.81,85.39,88.2,89.33,89.33,89.33,American,AL,https://www.youtube.com/watch?v=rm3FcEt0Ah8
AL111,"talk about, distinguish between, get to, worry about",10,1.17,86.36,6.36,3.64,92.73,96.36,96.36,96.36,97.27,American,AL,https://www.youtube.com/watch?v=Rt9ZvXwueas
AL112,"welcome to, start by, investigate with, release into, lead to, go to, base on, increase in, result in, publish by, argue about, share with, come from, see around, base on, go to, convert into, differ from, release into, regard from, make by, result in, look at, transport to, live in, contribute to, look at, use for, leave over, valorise into, compete with, accord to, derive from, range from, produce on",20,5.59,50.94,19.71,16.35,70.65,87,91.4,91.4,91.82,American,AL,https://www.youtube.com/watch?v=E1J_sm5UYUM
AL113,"describe in, stand for, fit in, know about, improve over, define as, associate with, find in, appear on, produce by, apply as, happen in, grow on, grow on, allow for, serve as, apply in, come out, lead to, come from, use by",18,4.22,54.26,16.48,11.65,70.74,82.39,85.8,85.8,87.22,American,AL,https://www.youtube.com/watch?v=nD65UCM4qac
AL114,"welcome to, return to, provide for, look at, compete with, leave over, consist of, provide for, divide into, use for, refer to, use for, differ in, capture in, influence by, associate with, reflect in, base on, produce per, extract per, differ between, gain from, base on, fossilbase to, have on, compete with, take into, associate with, take into, think along, allow for, grow on, utilize by, compose of, use on, make by, digest by, use in, consist of, metabolize by, focus on",18,7.76,49.25,21.75,14.29,71,85.29,88.91,88.91,89.98,American,AL,https://www.youtube.com/watch?v=ZL5ZhEX2rgM
AL115,"run throughout, serve as, abbreviate to, make from, come to, produce by, use as, denote as, stand for, relate to, stand for, use as, make from, start from, help with, result in, look into, start with, deal with, carry out, come down, deal with, replace by, sum up, accord to, carry out, look at, require for, compare to, direct by, show in, look at",19,5.39,49.26,21.92,10.34,71.18,81.53,84.98,84.98,86.95,American,AL,https://www.youtube.com/watch?v=gQgST1y9oYc
AL116,"hang in, separate from, reach by, look at, look at, formulate in, lead by, make by, look for, related to, lead to, look at, depend on, refer to, earn back, add up, relate to, set up, separate from, associate with, spend over, result from, calculate by, work on",21,5.69,51.08,23.26,16.31,74.34,90.65,93.76,93.76,93.76,American,AL,https://www.youtube.com/watch?v=mRUJmFJiFkg
AL117,"welcome to, find in, look at, sit in, occur in, come in, divide over, induce by, result in, deprive of, preserve in, select from, use in, select for, attach to, lead to, come from, isolate from, go to, take from",21,5.39,49.87,19.74,14.55,69.61,84.16,86.49,86.49,88.31,American,AL,https://www.youtube.com/watch?v=yIXDum8a75Q
AL118,"welcome back, explain to, grow by, go to, suggest from, explain to, end up, consist of, need for, need for, need as, need for, need in, act as, synthesize by, supply from, serve as, base on, leave with, make up, represent in, look like, go into, write down, write out, calculate from, make from, generate in, convert to, secrete outside, indicate in, note of, serve as, serve as, base on, act as",18,7.16,51.83,12.57,13.87,64.4,78.27,82.2,82.2,83.51,American,AL,https://www.youtube.com/watch?v=zi9QXjJih48
AL119,"work at, come in, ask for, measure by, look at, earn at, relate to, consume per, produce per, look like, grow on, make by, operate in, return to, state of, explain to, measure by, enter of, pile up, increase in, represent by, have at, come to, come to, set up, define by, set up, do for, go into, break down, go into, act on, act on, set up, come from",20,8.37,58.92,15.89,9.54,74.82,84.35,87.53,87.53,88.75,American,AL,https://www.youtube.com/watch?v=AgzqjxTeyCk
AL120,"find in, calculate from, set up, look for, take for, dissolve into, take up, go from, consist of, dissolve in, convert by, measure as, calculate from, come from, show below, operate in, put to, see from, see from, set up, measure by, depend on, depend on, indicate in, find out, go out, stick out, work on, come out, calculate from, sum up, set up, violate for, lead to, result in",21,6.62,55.04,15.56,12.97,70.61,83.57,87.03,87.03,87.32,American,AL,https://www.youtube.com/watch?v=5sBALeb1qes
AL121,"welcome back, realize by, reflect by, know as, look at, produce per, flow in, lead to, look at, go up, add in, change in, base on, see from, set up, look at, feed for, set up, go in, go out, multiply with, see from, go to, divide by, point out, expect with, go to, divide out, come to, belong to, grow at, happen to, obtain from, qrate in, obtain by, set up, obtain from, manipulate in, base on, set up",17,7.21,57.89,16.58,11.05,74.47,85.53,87.11,87.11,87.89,American,AL,https://www.youtube.com/watch?v=7UqWIuIjbQ8
AL122,"add at, control by, happen to, look at, want to, think about, think about, increase in, go down, think in, go down, set up, balance for, lead to, multiply by, suggest by, set up, think about, do by, Nx for, come from, accord to, set up, combine in, eliminate from, fill in, calculate qs, look at",18,5.74,57.83,16.57,9.64,74.4,84.04,87.95,87.95,88.25,American,AL,https://www.youtube.com/watch?v=IiYDqPFx-4w
AL123,"see from, go over, think about, look at, calculate from, set up, set up, start with, look like, draw on, set up, indicate in, set up, relate to, set up, solve than, look at, show on, consist of, go on, apply for, apply for, think about, apply to, have per, go out, put in, depend on, relate to, accord to, find in, transfer from, happen with, look at, transfer from, write down, write down, write down, multiply with, think about, happen with, degrade in, hope by, find out, look at, think about, find back, put in, look at, write down, work in, transfer from, fill in, look at, look at, transfer from, operate in, think about, depend on, ask for, write down, look at, lead to, work with, add up, look at, look at, transfer to, conserve by, come in",23,12.92,55.18,17.73,12.95,72.91,85.86,87.65,87.65,88.25,American,AL,https://www.youtube.com/watch?v=Juu_B73PkjI
AL124,"provide under, talk about, begin by, focus on, happen on, seem like, explain to, say in, go on, figure out, look in, look at, look at, look at, think to, look at, come out, look at, look at, go off, do with, protect by, protect from, talk about",16,5.53,70.79,14.6,6.03,85.4,91.43,92.7,92.7,93.02,American,AL,https://www.youtube.com/watch?v=tNVnKJ9T9Eg
AL125,"give to, do at, talk about, show to, talk about, supply from, consume per, look at, come to, come to, start with, end with, divide by, come to, build in, come to, come to, come to, define by, divide by, multiply by, come in, come out, multiply by, come from, multiply by, come to, come to",17,3.86,62,15.5,10,77.5,87.5,89,89,90.5,American,AL,https://www.youtube.com/watch?v=Uj4wO6HbuB0
AL126,"base on, do on, look at, come from, come from, come to, divide by, multiply by, calculate as, find for, find at, divide by, calculate for, multiply by, multiply by, have for, multiply by, multiply by, fill in, multiply by",19,4.64,59.6,17.68,6.57,77.27,83.84,87.88,87.88,88.89,American,AL,https://www.youtube.com/watch?v=KAgCGeX48TQ
AL127,"calculate as, think about, determine in, think about, produce in, multiply by, multiply by, multiply by, analyze at, do in, give of",20,3.67,61.34,19.07,7.73,80.41,88.14,89.18,89.18,90.21,American,AL,https://www.youtube.com/watch?v=7iBhqSz0NsA
AL128,"forget about, lead to, explain to, come from, come from, mean at, set up, multiply by, have of, multiply by, calculate from, go in, multiply by, multiply by, come out, come to, calculate from, come in, bring to",18,4.89,64.08,16.5,8.25,80.58,88.83,92.23,92.23,93.2,American,AL,https://www.youtube.com/watch?v=JjJwMH6hm5Y
AL129,"focus on, look like, write down, write down, write in, involve in, start with, go into, come out, write down, add up, lead to, succeed in, show in, indicate by, do by, produce per, consume per, depend on, reduce to, discuss in",21,5.59,55.77,15.71,10.9,71.47,82.37,84.29,84.29,85.26,American,AL,https://www.youtube.com/watch?v=ppVZb0jvJzY
AL130,"depend on, depend on, define by, lead to, lead to, enter from, bind to, disengage at, attach to, load with, depend on, depend on, depend on, occupy in, base on, define as, change with, depend on, apply for, fluxcouple due, see as, go out, depend on, depend on, learn about, set up, look at, worry about, go within",19,0.72,53.04,18.24,11.15,71.28,82.43,85.14,85.14,85.81,American,AL,https://www.youtube.com/watch?v=dSH_HsKS4KA
AL131,"couple to, oxidize with, set up, take up, discuss in, work with, pump out, take up, use for, produce per, engage in, occur in, take up, distribute over, occur with, lead to, lead to, maintenance with, show in, multiply by, couple to, work under, go into, show in, come to, qs over, look at, depend on, use for, compose of, indicate in, multiply by, multiply by, come to, go into, use with, lead to, express by, reflect in, use for, propose to, focus on",18,7.85,50.71,19.55,11.61,70.25,81.87,85.84,85.84,87.54,American,AL,https://www.youtube.com/watch?v=hONMFdvxRw4
AL132,"lead to, focus on, indicate in, obtain from, look at, enter into, do in, have in, fill in, fill in, solve for, do at, propagate in, indicate in, lead to, need at",17,6.16,57.38,15.44,13.42,72.82,86.24,89.26,89.26,90.27,American,AL,https://www.youtube.com/watch?v=C5zuE5eLwDE
AL133,"qvalue from, produce from, indicate by, accord to, follow from, calculate from, ai in, find by, set up, multiply with, multiply by, multiply by, lead to, run at, run at, run at, indicate on, occur at, accord to, consume for, lead to, use for, reflect on, consume for, see in, use for, use for, obtain by, consist of, calculate from, calculate from",23,7.33,48.12,13.65,11.6,61.77,73.38,76.11,76.11,76.45,American,AL,https://www.youtube.com/watch?v=gF9Y1NhvQ1c
AL134,"lead to, need for, consist of, characterize by, apply at, lead to, follow from, lead to, qvalue at, find from, supply as, compare to, consist of, sparge as, set up, speak for, coefficient for, reflect on, carry out, go to, lead to, think about, compare to, indicate with, lead to, remove by, look at, cool before, produce per, show in, remove by, follow from, indicate in, calculate from, lead to, discuss in",19,7.9,46.63,19.02,12.58,65.64,78.22,80.37,80.37,80.98,American,AL,https://www.youtube.com/watch?v=CuEuK17NJ5I
AL135,"aim at, aim for, add in, achieve by, coefficient in, add in, go for, do by, change by, double from, decrease from, favour over, show in, coefficient in, accord to, focusse on, achieve by, aim at, lead to, produce from, aim for, accord to, increase for, put by, go to, obtain from, aim at, work at, point out, relate to, lead to, use in, use under, break down, do in, focus on, flow with, carry on, lead to, point out",19,7.45,45.27,19.18,14.83,64.45,79.28,81.84,81.84,82.86,American,AL,https://www.youtube.com/watch?v=wlhvH95tfU8
AL136,"welcome to, look into, look into, look into, route in, express with, express in, represent as, take up, lump into, convert to, focus on, look into, leave over, look into, lead to, knock out, reflect on, take in, perform by, look into, translate into, show on, rely on, v2 in, choose for, need for, represent by, separate from, perform by, multiply by, multiply by, place on, work for, assume for, solve by, lead to, do by, consist of, do at, dive into, obtain from, provide from",21,8.64,47.26,18.35,13.5,65.61,79.11,80.38,80.38,82.28,American,AL,https://www.youtube.com/watch?v=UZD5ar8ts3I
AL137,"divide into, divide in, divide into, divide into, divide into, divide in, divide into, divide into, divide into, divide into, divide into, divide into",10,1.92,91.21,6.59,0,97.8,97.8,97.8,97.8,97.8,American,AL,https://www.youtube.com/watch?v=ntqySoFvNiw
AL138,"think about, come up, think about, go through, go in, deal with, deal with, look like, look like, think about, come in, come in, deal with, deal with, look like, look like, look like, direct of, look like, seem like, know about, go in, mean by",14,4.62,81.68,8.38,2.09,90.05,92.15,92.67,92.67,92.67,American,AL,https://www.youtube.com/watch?v=eWaZ0g0QI1g
AL139,"do for, think about, look at, think about, look at, think about, think about, cousin out, read in, base on, calm down, look at, look at, look at, look like, look like, look like",10,3.38,88.41,5.49,0.61,93.9,94.51,95.73,95.73,96.34,American,AL,https://www.youtube.com/watch?v=gJL8-2O8N4A
AL140,"go to, line up, look like, meet on, look like, look like",8,1.6,85.6,5.6,0.8,91.2,92,94.4,94.4,94.4,American,AL,https://www.youtube.com/watch?v=WUAzxx33NKU
AL141,"divide into, divide into, divide into, divide into, divide into, divide into, look like, look like, divide into, click on, divide into, divide into, divide into, divide into, divide into, divide into, divide to, divide into, divide into, divide into, divide into, divide into, divide into, divide into, divide into, divide into, divide into, look like, divide into, divide into, divide into, divide into",11,2.5,85,9,0,94,94,97,97,97,American,AL,https://www.youtube.com/watch?v=4eM6tbdVLto
AL142,"fit into, sit on, look at, go on",8,1.17,98.96,0,0,98.96,98.96,98.96,98.96,98.96,American,AL,https://www.youtube.com/watch?v=qm-2pJIVs1g
AL143,"go from, line up, look like, line up, figure out, cut out, cut off, cut off, cut off, cut off, cut off, cut off, figure out, figure out, cut off, start with, cut off, leave with, start with, end up, end up",18,4.44,87.2,8.54,0,95.73,95.73,95.73,95.73,95.73,American,AL,https://www.youtube.com/watch?v=OXjMoTk__DM
AL144,"think about, look at, go to, go to, look at, think of, have in, look at, look at, base on, look at, look at, look at",12,3.27,85.26,4.74,2.11,90,92.11,93.16,93.16,93.16,American,AL,https://www.youtube.com/watch?v=ftjz2o1EevY
AL145,dd,15,2.41,72.22,11.11,1.85,83.33,85.19,91.67,91.67,92.59,American,AL,https://www.youtube.com/watch?v=pM7kDq0He34
AL146,"have than, look at, have than, have than, look at, start at, start at, get to, go from, have than",14,1.4,91.03,5.13,0,96.15,96.15,97.44,97.44,97.44,American,AL,https://www.youtube.com/watch?v=Hs_vg_F0mBw
AL147,"look at, look at, think of, go in, get to, think about, start at, count by, get to, count from, get to, start at",10,2.24,96.23,1.89,0,98.11,98.11,98.11,98.11,98.11,American,AL,https://www.youtube.com/watch?v=-1SVs_MYDWE
AL148,"do in, respond to, go into, break down, think about, go to, care about, think about, involve in, live off, compose of, construct in, make up, construct in, coalesce in, come from, get around, go into, expose to, come from, come from, come from, hear about, talk about, build up, build out, talk about, go to, assist by, build up, build up, break down, talk about, make up, talk about, talk about, make up, make up, break down, interact with, guess on, break off, look like, break up, make up, break down, look around, look at, look at, come from",15,9.1,66.83,10.97,9.23,77.81,87.03,89.53,89.53,90.27,American,AL,https://www.youtube.com/watch?v=i-sYu5K2IFo
AL149,"refer to, do in, seem like, look at, break down, connect to, break off, turn into, bond to, depict with, go into, go from, think about, jump out, fall through, fall down, fall down, sit on, go to, break down, think about, go on, come out, go into, think about, start with, end up, pop off, turn into, know as, pluck off, pluck off, pop off, bond to, go into, use in, go from, get to",19,5.3,74.7,7.91,5.93,82.61,88.54,91.7,91.7,92.49,American,AL,https://www.youtube.com/watch?v=0VM7sLi9ALY
